episode_num,episode_title,link,Aang,Katara,Sokka,Zuko,Azula,Toph
1,The Boy in the Iceberg,http://atla.avatarspirit.net/transcripts.php?num=101," (whispering in a weak voice) I need to ask you something. (still whispering) Please... come closer. (in a normal, even excited voice) Will you go penguin sledding with me? What's going on here? (batting the spear anway, absently) I'm not sure. Appa! Are you all right? Wake up, buddy. Haha! You're okay! This is Appa, my flying bison. Don't worry. It'll wash out. So, do you guys live around here? I'm A... aaaahhhh... ahhhhhh.... aaah aaah aaah AAAAAAACHOOOO! I'm Aang. (He sniffles and rubs his nose.)  Really? It felt higher that that. Sure am. Well, if you guys are stuck Appa and I can give you a lift. Okay. First time flyers, hold on tight! Appa, yip yip! (shaking the reigns again) Come on, Appa. Yip yip. Appa's just tired. A little rest and he'll be soaring through the sky. You'll see. Oh... I was smiling? Hey. Whatcha thinkin' about? (looking disconcerted) Uhh... no. I didn't know him... I mean, I knew people that knew him, but I didn't. Sorry. Sleep tight. Aaahhh! Whaaaa! Uh... why are they all looking at me like that? Did Appa sneeze on me? 'Extinct'? It's not for stabbing. (He creates a jet of air that sucks the staff back into his hand.) It's for airbending. Not magic, airbending. It lets me control the air currents around my glider and fly. Check again! (as he crashes) Oof! You're a waterbender! (slurring) Sthee? Now my tongue ith thuck to my sthaff. (gesturing over his shoulder at the toilet) Wow! Everything freezes in there! What war? (He hops down off of Appa) What are you talking about? PENGUIN! Haha! Hey, come on little guy. Wanna go sledding? Oof! Heh heh, I have a way with animals. (He puts his arms out and waddles in imitation of the four flippered penguins) Yarp! Yarp yarp! Yarp! Yarp yarp! Yarp! You got a deal! Just one little problem. I'm an airbender, not a waterbender. Isn't there someone in your tribe who can teach you? This isn't right. A waterbender needs to master water. What about the North Pole? There's another Water Tribe up there, right? Maybe they have waterbenders who could teach you. But you forget I have a flying bison. Appa and I can personally fly you to the North Pole. Katara, we're gonna find you a master! Well, you think about it. But in the meantime, can you teach me to catch one of these penguins? You still are a kid! Whoa... what is that? If you wanna be a bender, you have to let go of fear. Okay, back up. I have friends all over the world, even in the Fire Nation. I've never seen any war. I don't know... a few days, maybe? What? That's impossible. Do I look like a hundred-twelve year old man to you? A hundred years! I can't believe it. I did get to meet you. Huh? What's that you said about booby traps? Uh oh. Hold on tight!"," Sokka, look! (trying to retain control of the globe of water) But Sokka! I caught one! Hey! It's not magic. It's waterbending, and it's- You're calling me weird? I'm not the one who makes muscles at myself every time I see my reflection in the water. and  Watch out! Go left! Go left! You call that left? So it's my fault? You are the most sexist, immature, nut brained... Ugh, I'm embarrassed to be related to you! Ever since Mom died I've been doing all the work around camp while you've been off playing soldier! I even wash all the clothes! Have you ever smelled your dirty socks? Let me tell you, NOT PLEASANT! No, that's it. I'm done helping you. From now on, you're on your own! You mean I did that? He's alive! We have to help. Stop it! What? What is it? Uh... sure. I guess. Oh, yeah, I'm sure he's a spy for the Fire Navy. You can tell by that evil look in his eye. The paranoid one is my brother, Sokka. You never told us your name. (gasping) You're an airbender! We'd love a ride! Thanks! (She gets on Appa.)  Are you hoping some other kind of monster will come along and give you a ride home? You know... before you freeze to death? Why are you smiling at me like that? Hey. I guess I was wondering – your being an airbender and all – if you had any idea what happened to the Avatar. Okay. Just curious. Goodnight. (voice over) Aang! Aang, wake up! (He wakes up, gasping) It's okay. We're in the village now. Come on, get ready. Everyone's waiting to meet you. Aang, this is the entire village. Entire village, Aang. Aang, this is my grandmother. That was amazing. Well... sort of. Not yet. I told you! He's the real thing, Gran Gran! I finally found a bender to teach me. But he's special. I can tell. I sense he's filled with much wisdom. Have you seen Aang? Gran Gran said he disappeared over an hour ago. Aang? (giggles) Hahaha... Aang, I'll help you catch a penguin if you teach me waterbending. (looking away in sadness) No. You're looking at the only waterbender on the whole South Pole. Maybe. But we haven't had contact with our sister tribe in a long time. It's not exactly 'turn right at the second glacier.' It's on the other side of the world. (happily) That's... (then uncertain) I mean, I don't know. I've never left home before. (mock teacherly tone) Okay, listen closely my young pupil. Catching penguins is an ancient and sacred art. Observe. I haven't done this since I was a kid! (deathly serious) A Fire Navy ship, and a very bad memory for my people. Aang, stop! We're not allowed to go near it. The ship could be booby trapped. This ship has haunted my tribe since Gran Gran was a little girl. It was part of the Fire Nation's first attacks. Aang, how long were you in that iceberg? I think it was more like a hundred years! Think about it. The war is a century old. You don't know about it because, somehow, you were in there that whole time. It's the only explanation. (kneeling next to him) I'm sorry, Aang. Maybe somehow there's a bright side to all this. (smiles) Come on. Let's get out of here. Aang? Let's head back. This place is creepy."," It's not getting away from me this time. Watch and learn, Katara. This is how you catch a fish. (whispers) Shhh. Katara, you're gonna scare it away. Mmmm... I can already smell it cookin'! (very exasperated) Ugh! Why is it that every time you play with magic water I get soaked? Yeah, yeah, an ancient art unique to our culture, blah blah blah. Look, I'm just saying that if I had weird powers, I'd keep my weirdness to myself. Ahhh! You don't like my steering. Well, maybe you should have waterbended us out of the ice. I knew I should have left you home. Leave it to a girl to screw things up. (noticing the cracking iceberg) Uh... Katara? Katara! Settle down! Okay, you've gone from weird to freakish, Katara. Yup. Congratulations. Katara! Get back here! We don't know what that thing is! (raising his spear at the boy) Stop! Ahh! You tell us! How'd you get in the ice? (Poking Aang with his spear) And why aren't you frozen? What is that thing? Right. And this is Katara, my flying sister. Ewww! Aahh!!! Ugh! Don't answer that! Did you see that crazy bolt of light? He was probably trying to signal the Fire Navy. (incredulous) You just sneezed... and flew ten feet in the air. Giant light beams... flying bison... airbenders... I think I've got Midnight Sun Madness. I'm going home to where stuff makes sense. Oh, no... I am not getting on that fluffy snot monster. Wow. That was truly amazing. (disgusted) Uuuuugh. (grabbing Aang's staff) What is this, a weapon? You can't stab anything with this. You know, last time I checked, humans can't fly. (gasping) My watchtower! Great. You're an airbender, Katara's a waterbender, together you can just waste time all day long. Now men, it's important that you show no fear when you face a firebender. In the Water Tribe, we fight to the last man standing. For without courage, how can we call ourselves men? Listen! Until your fathers return from the war, they're counting on you to be the men of this tribe. And that means no potty breaks. (sighing) Okay... who else has to go? Ugh! Katara, get him out of here. This lesson is for warriors only. Stop! Stop it right now! (To Aang) What's wrong with you? We don't have time for fun and games with a war going on. You're kidding, right? He's kidding, right?"," Finally. (He turns to address someone o.c.) Uncle, do you realize what this means? It means my search - it's about to come to an end. That light came from an incredibly powerful source. It has to be him! (exploding in anger) I don't need any calming tea! I need to capture the Avatar. Helmsman, head a course for the light! Because their honor didn't hinge on the Avatar's capture. Mine does. This coward's hundred years in hiding are over. Ha! Heeya! Enough. I've been drilling this sequence all day. Teach me the next set. I'm more than ready. Grrrr... huh! (He blasts one of the guards backwards with a gout of fire.) The sages tell us that the Avatar is the last airbender. He must be over a hundred years old by now. He's had a century to master the four elements. I'll need more than basic firebending to defeat him. You WILL teach me the advanced set! (voice over) The last airbender. (Cut to a profile view of Zuko looking through his telescope) Quite agile for his old age. Wake my uncle! Tell him I found the Avatar... ...as well as his hiding place.",,
2,The Avatar Returns,http://atla.avatarspirit.net/transcripts.php?num=102," Yeh, we were on the ship and there was this booby trap and well... (putting his hand to his head as if trying to puzzle out the thought) ...we “boobied” right into it. Don't blame Katara! I brought her there. (Looking downcast) It's my fault. (smiling earnestly) You should try it sometime. (momentarily confused, then brightening) I am? Great! Katara, I don't want to come between you and your family. Thanks for penguin sledding with me. (putting a hand on Appa) Guess I'll go back home and look for the airbenders. (Thinking) Wow, I haven't cleaned my room in a hundred years. Not looking forward to that.  It was nice meeting everyone. Come on, Appa, you can do it! Yip! Yip!(sadly) I'll miss you too. Come on, boy. Yeh, I liked her too. The village! (He slides down off his perch) Appa, wait here! Hey Katara. Hey Sokka. Looking for me? Well, you're just a teenager. If I go with you, will you promise to leave everyone alone? Don't worry, Katara, it'll be okay. (They push him forward roughly) Take care of Appa for me until I get back. So... I guess you never fought an airbender before. I bet I can take you both with my hands tied behind my back. (panting) You haven't seen my staff around, have you?  Thanks anyway! (whispering) Sorry... My staff! Appa! (drained) Hey Katara. Hey Sokka. Thanks for coming. I dropped my staff. (sitting cross legged on the bridge of the saddle, a slightly sad expression on his face) I don't know. I just sort of... did it. Because... I never wanted to be. (looking down sadly) And how am I going to do that? That's what the monks told me. (now smiling) We can learn it together! (producing a scroll) All right, but before I learn waterbending, we have some serious business to attend to (he airbends himself over to them and opens the scroll to reveal a map) here, here, and here. Here (pointing to the eastern Earth Kingdom) we'll ride the hopping llamas. Then waaaay over here (pointing to a spot on the southern Air Nomad islands) we'll surf on the backs of giant koi fish. Then back over here we'll ride the hog-monkeys. They don't like people riding them, but that's what makes it fun!"," Aang didn't do anything. It was an accident. (angrily) Sokka, you're making a mistake. (motioning to Aang) Aang is not our enemy! Don't you see? Aang's brought us something we haven't had in a long time. Fun. Grandmother, please, don't let Sokka do this. Then I'm banished too! C'mon, Aang, let's go! To find a waterbender! Aang is taking me to the North Pole! So, you're leaving the South Pole? This is goodbye? Where will you go? (cutting her off angrily) You happy now? There goes my one chance of becoming a waterbender! Sokka, get out of the way! Aang? No, Aang! Don't do this! We have to go after that ship, Sokka. Aang saved our tribe; now we have to save him. Why can't you realize that he's on our side? If we don't help him, no one will. I know you don't like Aang, but we owe him and I— (with a happy gasp) Sokka! He's not my— (turning to the canoe) There's no way we're gonna catch a war ship with a canoe.  Appa! Please, Appa, we need your help. Aang needs your help. Sokka doesn't believe you can fly, but I do, Appa. (Coaxingly) Come on. Don't you wanna save Aang? (ecstatic) You did it, Sokka! (hysterical) Aang! No! (voice-over as Aang sinks) Aang! Aang! AANG! (incredulously) Did you see what he just did?(worried) Aang! Are you okay? Hurry up, Sokka! How did you do that? With the water? It was the most amazing thing I've ever seen. Why didn't you tell us you were the Avatar? But Aang, the world's been waiting for the Avatar to return and finally put an end to this war. According to legend, you need to first master water, then earth, then fire, right? Well, if we go to the North Pole you can master waterbending. And Sokka, I'm sure you'll get to knock some firebender heads on the way. Then we're in this together. What's there?"," (pointing at Aang) I knew it! You signaled the Fire Navy with that flare! You're leading them straight to us, aren't you? Aha! The traitor confesses! Warriors, away from the enemy! (The children walk away from Aang and towards Sokka and Gran Gran.) The foreigner is banned from our village! No! I'm keeping my promise to Dad. I'm protecting you from threats like him! Fun? We can't fight firebenders with fun! Get out of our village. Now! (pointing at Katara) Where do you think you're going? Katara! (She stops) Would you really choose him over your tribe? Your own family? Let's see your bison fly now, air boy. Yeh, I thought so. All right! Ready our defenses! The Fire Nation could be on our shores any moment now! (cutting him off forcefully and pointing to the fortifications) And no potty breaks! (disappointed at the tower's collapse) Oh man! Ohhh, man! (dryly) Hi...Aang. Thanks for comin'. No way. Katara, I— Katara! Are you gonna talk all day or are you comin' with me? Get in. We're going to save your boyfriend. Whatever. Yeah... okay, Gran. You just love taking me out of my comfort zone, don't ya? (drearily) Go. Fly. Soar. Up. Ascend. Elevate. What was it that kid said? Yee-ha? Hup hup? Wahoo? Uh... yip yip? He's flying! He's flying! Katara, he's—! (Katara gives him a smug look. Then, nonchalantly) I mean, big deal, he's flying. Now that was some waterbending! Well, I couldn't let you have all the glory. Got it! Ha! That's from the Water Tribe! Katara! (to himself) I'm just a guy with a boomerang; I didn't ask for all this flying and magic. Yip yip! Yip yip! (somewhat dreamily) I'd like that. I'd really like that."," Where are you hiding him? He'd be about this age? Master of all elements? I know you're hiding him! (incredulous) You're the airbender? You're the Avatar? I've spent years preparing for this encounter. Training. Meditating. You're just a child! Head a course to the Fire Nation. I'm going home. This staff will make an excellent gift for my father. I suppose you wouldn't know of fathers, being raised by monks. Take the Avatar to the prison hold. And (shoving the staff in Iroh's direction) take this to my quarters. Looks like I underestimated you. What is that? Shoot them down! That kid, Uncle, just did this. (Shot widens to show the prow buried in ice) I won't underestimate him again. Dig this ship out and follow them! (In the background, some soldiers are using controlled firebending to thaw out their compatriots frozen by Katara) As soon as you're done with that.",,
3,The Southern Air Temple,http://atla.avatarspirit.net/transcripts.php?num=103," (while adjusting Appa's reins) Wait 'til you see it, Katara. The Air Temple is one of the most beautiful places in the world. That's why I'm so excited! I know, but I need to see it for myself. Wake up, Sokka! Air Temple here we come! Sokka! Wake up! (He begins to run the stick up and down Sokka's sleeping bag.) There's a prickle snake in your sleeping bag! (pokes his head out from behind Sokka.) Great! You're awake. Let's go. Oh, that was food? I used it to start the campfire last night. Sorry. The Batola mountain range! We're almost there! What about 'em? (close-up of Aang's face, which relaxes into hopeful optimism) Just because no one has seen an airbender doesn't mean the Fire Nation killed them all. (Cut to a front view of both, sitting up front.) They probably escaped. You don't understand, Katara. The only way to get to an airbender temple is on a flying bison, and I doubt the Fire Nation has any flying bison. Right, Appa? (voice-over) Yip yip!  There it is... the Southern Air Temple. (to Appa) We're home, buddy. We're home. So that's where my friends and I would play airball! And... over there would be where the bison would sleep... and...  This place used to be full of monks and lemurs and bison. Now there's just a bunch of weeds.  I can't believe how much things have changed. Hahaha! Aang seven, Sokka zero!  (approaching happily with the ball) Okay! What is it? Nice one. But enough practicing. We have a whole temple to see!  (calls from o.c.) Hey guys!  I want you to meet somebody. Monk Gyatso, the greatest airbender in the world. He taught me everything I know.  Hmm... This whole Avatar thing... maybe the monks made a mistake. (o.c.) But Gyatso, how do I know if I'm ready for this? (excitedly as he jumps up to turn and face Gyatso fully) Who is it? (smiling) All right. and  Yeah. (moves forward to go into the Temple)  (climbing the steps.) The Air Temple Sanctuary. There's someone I'm ready to meet.  It's not impossible. I survived in the iceberg for that long. Katara, whoever's in there might help me figure out this Avatar thing! The key, Sokka, is airbending. (calling inside) Hello? Anyone home?  (uncertain) I'm not sure, but it feels like I know them somehow. Look! (He points to a statue.) That one's an airbender! That's the Avatar cycle. Wow! There's so many! (dazed) Huh? That's Avatar Roku, the Avatar before me. I'm not sure... I just know it somehow. and  Lemur! Don't listen to him! You're going to be my new pet. (calling) Wait! Come back! Hey! Come back!  Come on out, little lemur. That hungry guy won't bother you anymore. (surprised) Firebenders? They were here? Gyatso...  (tired) I'm sorry. (sadly) But you were right. And if firebenders found this temple that means they found the other ones, too. I really am the last airbender.  (still looking at the statue) How is Roku supposed to help me if I can't talk to him? Looks like you made a new friend, Sokka. (as the lemur scurries up his chest to perch on his head.) Hey little guy. You, me, and Appa. (View switches to frontal shot of the three.) We're all that's left of this place. We have to stick together. Katara, Sokka...   (Camera switches to Katara and Sokka, the latter's mouth still full, a fruit in his hand.)  ... say hello to the newest member of our family.  (surprised as the lemur jumps off camera and returns a second later with a fruit.) Momo."," (cautious) Aang, I know you're excited, but it's been a hundred years since you've been home. It's just that a lot can change in all that time. (uneasy) Aang? Before we get to the temple, I want to talk to you about the airbenders. (close-up of Katara's face.) Well, I just want you to be prepared for what you might see. The Fire Nation is ruthless. They killed my mother and they could have done the same to your people. I know it's hard to accept. Aang, it's amazing! You're lucky enough to be one of the first outsiders to ever visit an airbender temple and all you can think about is food? (Camera cuts to follow them from above and behind.)  What's wrong? (seeing the helmet, accusingly) Fire Nation. (turning to call to Aang) Aang, there's something you need to see. (uncertainly) Uh... just a new waterbending move I learned. (walking away from him) I can for Aang's sake.  If he finds out that the Fire Nation invaded his home, he'll be devastated. (coming forward and placing a hand on Aang's shoulder.) You must miss him. Where are you going? But Aang... no one could have survived in there for a hundred years. Good point. Who are all these people? (pointing) And this one's a waterbender. They're lined up in a pattern. Air, water, earth and fire. Of course! They're Avatars. All these people are your past lives, Aang. It's true. When the Avatar dies he's reincarnated into the next nation in the cycle. Aang, snap out of it! Who is that? There's no writing. How do you know his name? (exasperated) You're making a sound! (worried) Aang! What happened? Oh no, it's his avatar spirit! He must have triggered it! I'm gonna try and calm him down. (shouting calmly) Aang, I know you're upset...  ... and I know how hard it is to lose the people you love. I went through the same thing when I lost my mom. Monk Gyatso and the other airbenders may be gone, but you still have a family. Sokka and I, we're your family now. It's okay. It wasn't your fault. Everything's packed. You ready to go? Maybe you'll find a way. What are you going to name him?"," Sleep now... temple later... (startled) Aaahhh! Get it off! Get it off! Aaahhh!  (annoyed) Hey, stomach, be quiet, all right? I'm trying to find us some food.  Hey! Who ate all my blubbered seal jerky? (incredulous) You WHAT? Awww, no wonder the flames smelled so good. So where do I get something to eat?  I'm just a simple guy with simple needs. So, uh, this airball game? How do you play?  (getting up painfully) Making him feel better is putting me in a world of hurt. Katara, check this out. We should tell him. You know, you can't protect him forever. Katara, firebenders were here. You can't pretend they weren't. Who's that? (Pops out from behind Aang eagerly.) And whoever's in there might have a medley of delicious, cured meats! I don't suppose you have a key? Statues?! That's it? Where's the meat?  (skeptical) Past lives? Katara, you really believe in that stuff? You were a firebender? No wonder I didn't trust you when we first met. (growls in frustration) You just couldn't get any weirder! (whispering) Firebender. Nobody make a sound. Shhhh! (whispering, ready with his weapon) That firebender won't know what hit 'em. (cut to Sokka, drooling) Dinner... Not if I get him first! I wanna eat you! Oof!  Hey! No Fair! (pulling back the curtain) Hey Aang, you find my dinner yet?  Aang, I wasn't really going to eat the lemur, okay? (He sees the skeleton and does a doubletake.) Oh, man... come on, Aang, everything will be all right. Let's get out of here. Aang! Come on, snap out of it! Aaahhh! He found out firebenders killed Gyatso. (Hanging onto the rubble, trying not to get blown away.) Well, do it before he blows us off the mountain!  (gently) Katara and I aren't going to let anything happen to you. Promise. (mouth full) Can't talk. Must eat."," Uncle, I want the repairs made as quickly as possible. I don't want to stay too long and risk losing his trail. (turning on his uncle angrily) Don't mention his name on these docks! Once word gets out that he's alive every firebender will be out looking for him and I don't want anyone getting in the way. (with distaste) Captain Zhao. Yes... you wouldn't believe what happened. (He gives his uncle a sideways glance and immediately passes the buck.) Uncle! Tell Commander Zhao what happened. (uncomfortable) Uh, yes! Right into an Earth Kingdom ship. Sorry, but we have to go. (Cut to Zuko's upper body.) If my father thinks the rest of the world will follow him willingly, then he is a fool.  (cut to Zuko.) We haven't found him yet. (still looking away) No. Nothing. (defiantly) I haven't found anything. It's like you said. The Avatar probably died a long time ago. Come on, Uncle, we're going. I underestimated him once, but it will not happen again. (alarmed) Commander Zhao, I've been hunting the Avatar for two years and I... Why? Are you worried I'm going to try and stop you? (Zuko stands in defiance.) Don't underestimate me, Zhao. I will capture the Avatar before you.  You're wrong. Once I deliver the Avatar to my father he will welcome me home with honor and restore my rightful place on the throne. That's not true. (With a cry of indignation, launches himself to his feet, bringing his face within inches of Zhao's.) Maybe you'd like one to match! An agni kai. At sunset. I will never forget.  (standing up) I refuse to let him win.  Next time you get in my way, I promise I won't hold back. (quietly) Did you really mean that, Uncle?",,
