episode_num,episode_title,link,Aang,Katara,Sokka,Zuko,Azula,Toph
20,"The Siege of the North, Part 2",http://atla.avatarspirit.net/transcripts.php?num=120," Hello? I'm sorry to disturb you, but I just really need to find the Moon and the Ocean spirits. Yes! I need –(getting up) Come back! Roku! Roku, the Water Tribe is under attack. I need to find the Ocean and Moon spirits! Who?(with relief) Oh! Whew! You're just a curly tailed blue nose.(in unison with voice over from Roku) Show no fear. Show no emotion at all. Hello? I'm looking for a spirit named ""Koh."" Thank you.  You know me? I didn't know that. Why did he... or I... try to kill you? I need to find the Moon and the Ocean. Please, help me find them. An entire culture could be destroyed if I don't get their help. What do you mean? How can I find them and protect them?(smiling) The koi fish! I must be going now. The spirits are in trouble. I need to get back to the physical world. Hei-Bai!(dismounting) This is where I came in. (He jumps onto the platform underneath the paifang) But how do I get back? Momo! (looking at his hands) Momo? (Realizing his predicament) Oh no! Where's my body?(threateningly) Good to be back.  Appa! We need to get to the oasis! The spirits are in trouble! Wait, we can't just leave him here.  No, if we leave him, he'll die.(his hand on his head as well) I feel it too. (Aang's looks up) The Moon Spirit is in trouble. Zhao! Don't! Destroying the moon won't just hurt the Water Tribe. It will hurt everyone – including you. Without the moon, everything would fall out of balance. You have no idea what kind of chaos that would unleash on the world.(voice deep and other-worldly) No, it's not over.(extending a forearm and laughing) Come here."," I can't believe I lost him.(getting up) Okay. It's all right. You stay here, Momo, in case Aang comes back. I'm not worried they'll get away in the blizzard. I'm worried that they won't. Look! That's gotta be Aang!(beginning to waterbend) Trust me, Zuko, it's not going to be much of a match. It's too late. It's dead. What about Aang? (Cut to a shot behind Katara and Pakku as they look at Aang and Momo in the background) He still needs to learn waterbending. You too, Momo."," You did everything you could and now we need to do everything we can to get him back.(continuing from o.c.)  Zuko can't have gotten far. We'll find him. Aang's gonna be fine. Yip! Yip! They're not gonna die in this blizzard. If we know anything it's that Zuko never gives up. They'll survive – and we'll find them! Hey! This is some quality rope! Sure we can. Let's go. Yeh, this makes a lot of sense. Let's bring the guy who's constantly trying to kill us! Are you okay? What do you mean?(reaching for her) No! You don't have to do that!(from o.c. as the camera shows a close up of their clasped hands) I won't let you! Your father told me to protect you!(in despair) NO!(softly) She's gone. (He hugs her body tightly) She's gone. You must be proud."," Shelter! I finally have you. But I can't get you home because of this blizzard. (He walks over to the cave entrance to look out at the falling snow, his back to the camera) There's always something. Not that you would understand. You're like my sister. Everything always...came easy to her. She's a firebending prodigy – and everyone adores her. (Cut to a frontal view of Zuko) My father says she was born lucky. He says I was lucky to be born. (Cut to view of his back again.) I don't need luck though, I don't want it. I've always had to struggle and fight and that's made me strong. It's made me who I am. Guess we'll be here awhile. Welcome back. That won't be enough to escape.(assuming a firebending stance) Here for a rematch? You tried to have me killed! I had no choice! Take my hand! I'm tired.",,
21,The Avatar State,http://atla.avatarspirit.net/transcripts.php?num=201," (as he falls) Aaahhh! (he lands on the floor of the Air Temple) Oof! Nah. Just a nightmare. (unsettled) I was in the Avatar state, but I was outside my body watching myself. It was scary. I was scary. Appa, yip yip! (humbly) I try not to think about it too much. (alarmed) What?! No I'm not! See, it's this special state where— (with uncertainty) Right... but I'm don't know how to get in or out of the Avatar state, much less what to do once I'm there. (o.c.) General Fong? (looks down in uncertainty) I'm in. (looks up with determination) I'll fight the Fire Lord. (quietly) I told the general I'd help him... by going into the Avatar state. (pleading) Katara, I'm just being realistic. I don't have time to do this the right way. (He looks sad and almost ashamed.)  Ten-fold energy, huh? (slurps; twitch, twitch, twitch)  (speaking in a fast, high-pitched, hyper voice while zipping everywhere on his air-scooter) Is it working, is it working? I can't tell! Somebody tell me if I'm in the Avatar state 'cause I don't have a good view of myself! Am I talking too loud? (collides with a column, his air ball disappear and his shawl falling over his head.) Ooof! (cheerfully) I love surprises. Aaahhh! (looks at his hands and holds them up) Still not glowing. This is just mud! Aaaaachoooo! (o.c.) Sure. I'm really glad you told me that. But I still need to do this. No, you don't. Every day more and more people die. I'm already a hundred years late. Defeating the Fire Lord is the only way to stop this war. I have to try it. (sadly) Goodnight. (as the water vortex knocks him overboard) Aaahhh! (softly) Sokka. Sokka, wake up. I don't think we should be trying to bring on the Avatar state. Yes. (apprehensive) Do you think the general will be mad? The thing is, I don't think we'll ever be able to trigger it on purpose. So, I guess that's it. I'm sure. I can only reach the Avatar state when I'm in genuine danger. (gets hit with the desk) Ugh! (about to hit the ground) Aaahhh! What are you doing? I am not your enemy! I won't fight you! You can't fight forever! Aaahhh! Don't hurt her! Stop this! You have to let her go. (desperately) I'm trying... I'm trying! (hysterical) You don't need to do this! What do you mean? (tired and remorseful) I'm sorry, Katara. I hope you never have to see me like that again. (The two look up as Fong begins to speak.) (Cut to Fong, who walks forward, spreading his arms.)  You're out of your mind."," Aang? Do you wanna talk about it? (respectfully) Thank you, Master Pakku.  (calls back as they fly off) Say hi to Gran Gran for me! (Cut to a scene looking down at the ship as Appa flies toward the screen.)  (pleased) ""Mighty Katara""? I like that. Aang still needs to master all four elements. (irritated) No, nothing's decided. We already have a plan. Aang's pursuing his destiny his way. Aang, no. This is not the right way. There's a right way to do this. Practice, study, and discipline. (angrily) If you two meatheads want to throw away everything we've worked for, fine. Go ahead and glow it up! (She exits to the right. Aang rises and starts after her.)  (o.c.) Can we talk about something? Do you remember when we were at the air temple and you found Monk Gyatso's skeleton? It must have been so horrible and traumatic for you. I saw you get so upset that you weren't even you anymore. I'm not saying the Avatar state doesn't have incredible—and helpful power. But you have to understand, for the people who love you, watching you be in that much rage and pain is really scary. I don't understand. (quietly) I can't watch you do this to yourself. I'm not coming tomorrow. (She begins to walk off toward the screen, but pauses.) Goodnight. (She exits off screen.)  I wonder what crazy thing they're trying now. (Cut to Momo, who makes a purring noise and closes his eyes.) Maybe we should just make sure Aang's okay. (to Sokka) What's going on? Aaahhh! (grunts, straining) I can't move! (sinking deeper) Aaahhh! Aang, I'm sinking! (terrified) Aaahhh! Please! I think we're all set."," (excitedly) There it is! Not bad, not bad. But, sir, the thing is Aang can only do those things when he's in the Avatar state. Why not? Remember when he took out the Fire Navy? He was incredible. Or just glow it up and stop that Fire Lord. (Looking bored.) I guess he could talk the Fire Lord to death. Maybe I can shock you into the Avatar state. (groggily) Wha...? You sure? (accepting) Okay. What can he say? You're the Avatar. Who knows better than you? Aang! The general's gone crazy. He's trying to force Aang into the Avatar state! (nervous coaxing) Good bird/horse thingy. Katara! No! (Fong sinks the bird creature's legs into the dirt and Sokka gets tossed from his ostrich, landing in the hole of one of the discs.) Waaaahhh! Oof! (bonks Fong on the head and knocks him out) Anybody got a problem with that? (Soldiers all shake their heads in unison) (Sokka dismounts from the creature. The soldiers approach the others and bow. The creature runs off in the background.) "," (dejectedly) Three years ago today I was banished. I lost it all. (He looks up suddenly.)  I want it back. I want the Avatar, I want my honor, I want my throne. I want my father not to think I'm worthless. We don't need anymore useless things. You forget we have to carry everything ourselves now. (accusingly) What are you doing here? (furiously) Don't call me that! (with shocked and quiet disbelief) Father regrets? He... wants me back? (o.c., happily) We're going home. After three long years. It's unbelievable. (Zuko walks behind a thoughtful Iroh, carrying some folded clothing. He walks off to the right of the screen.)  Did you listen to Azula? Father's realized how important family is to him. He cares about me. (defensively, turning his back to Iroh) You don't know how my father feels about me. (He stiffens) You don't know anything. (nastily) I think you are exactly what you seem a lazy, mistrustful, shallow old man who has always been jealous of his brother. (happily surprised) Uncle! You've changed your mind! We're finally going home. (wistfully) Home... You lied to me!"," (to her men) My brother and my uncle have disgraced the Fire Lord and brought shame on all of us. You may have mixed feelings about attacking members of the royal family; I understand. But I assure you, if you hesitate, I will not hesitate to bring you down. Dismissed. I'm sorry, Captain, but I do not know much about the tides. Can you explain something to me? Do the tides command this ship? (condescendingly) You said the tides would not allow us to bring the ship in. Do the tides command this ship? And if I were to have you thrown overboard, would the tides think twice about smashing you against the rocky shore? Well, then, maybe you should worry less about the tides who've already made up their mind about killing you and worry more about me, who's still mulling it over. 'Almost' isn't good enough! (o.c.) Hello, brother. Uncle. (arrogantly) In my country, we exchange a pleasant 'hello' before asking questions. (She gets up and walks over to face Zuko.) Have you become uncivilized so soon, Zuzu? Hmm... must be a family trait. Both of you so quick to get to the point. (She shatters one of Iroh's shells with her sharp nails on this last word. Iroh's face darkens.) I've come with a message from home. Father's changed his mind. Family is suddenly very important to him. He's heard rumors of plans to overthrow him—treacherous plots. Family are the only ones you can really trust. (Her voice and face soften.) Father regrets your banishment. He wants you home. (o.c.) Did you hear me? You should be happy. Excited. Grateful. (Camera returns to show her pleasant expression.) I just gave you great news. (interrupting him angrily) Don't interrupt, Uncle! (addresses Zuko. The camera pans to show his scarred face in the foreground, and Azula walks up beside him.) I still haven't heard my thank you. I am not a messenger. I didn't have to come all this way. I can see you need time to take this in. I'll come to call on you tomorrow. Good evening. (Azula walks off screen to the right.)  Brother! Uncle! (Cut back to Zuko and Iroh, both bowing. Iroh opens one eye slightly, watching the soldiers beside him.) Welcome. I'm so glad you decided to come. (pleasantly) Set our course for home, Captain. (smugly) Like I've never done that before. You know Father blames Uncle for the loss at the North Pole. And he considers you a miserable failure for not finding the Avatar. (o.c.) Why would he want you back home, except to lock you up where you can no longer embarrass him? Anyone who harbors these traitors will face the wrath of the Fire Lord. (menacingly) There will be no place left to hide.",
22,The Cave of Two Lovers,http://atla.avatarspirit.net/transcripts.php?num=202," So, you were showing me the octopus form. (blushing, slightly flustered) Oh... yeah. Thanks. Just... people. You guys are nomads That's great! I'm a nomad. (flatly) I know... you just said that. Hey, Sokka, you should hear some of these stories. These guys have been everywhere. They said they'll take us to see a giant night crawler. Yeah. Thanks for the help, but Appa hates going underground and we need to do whatever makes Appa most comfortable. (terrified) AAAAAHHHHH! So all you need is to trust in love to get through these caves? We can make it. Yeah, but I wouldn't mind a map, also. We found the exit! No... it's a tomb. It must be the two lovers from the legend. That's who's buried here. How are we gonna find our way out of these tunnels? What? Katara, what is it? Right... (totally clueless) Where are you going with this? (surprised) Us, kissing? (dreamily) Us... kissing... (also tries to laugh it off) Yeah, heh, heh. (He points at her for additional emphasis) I definitely wouldn't wanna kiss you!  (trying desperately to recover) No, no, I mean... if there was a choice between kissing you and dying... What? I'm saying I'd rather kiss you than die. (He holds clasps his hands together in a gesture of appeasement) That's a compliment. (dejected) What is wrong with me? (gloomily) We're gonna run out of light any second now, aren't we? Then what are we gonna do? It's made of some kind of crystals. They must only light up in the dark! (uncertainly) So... um... (worried) What about Sokka? Just like the legend says we let love lead the way. So, are you guys gonna come to Omashu with us? Okay. Thanks for everything, Moku."," (teasingly) What, like you're ready to go right now, naked guy? Right. Let me see your stance. (evaluates Aang's form and comes over to correct it) Your arms are too far apart. See, if you move them closer together you protect your center. You got it? Okay, let's see what you got. You make a fine octopus, Pupil Aang. (gesturing negatively with her hands as Sokka resurfaces behind her, Momo landing on his hand) We're not river people. Sokka's right. We need to find King Bumi so Aang can learn earthbending somewhere safe. (skeptically) Is this real or a legend? (terrified) AAAAAHHHHH! That's no campfire, Moku. (sympathetically) It's okay, Appa. We'll be fine. (less confidently) I hope. Sokka, this is the tenth dead end you've led us to. Everyone be quiet. Listen. Aang, look! This isn't the exit. These pictures tell their story. (voice-over) They met on top of the mountain that divided their two villages.  (voice-over) The villages were enemies so they could not be together. (voice-over) But their love was strong and they found a way. (voice-over) The two lovers learned earthbending from the badger moles. They became the first earthbenders. (voice-over) They built elaborate tunnels so they could meet secretly. Anyone who tried to follow them would be lost forever in the labyrinth. (voice-over) But one day the man didn't come.  He died in the war between their two villages. (voice-over) Devastated, the woman unleashed a terrible display of her earthbending power. She could have destroyed them all.  (voice-over) But instead she declared the war over.  Both villages helped her build a new city where they would live together in peace.  (voice-over) The woman's name was Oma and the man's name was Shu. The great city was named Omashu as a monument to their love. (reading the inscription) Love is brightest in the dark. I have a crazy idea. (hesitantly) Never mind, it's too crazy. I was thinking... the curse says we'll be trapped in here forever unless we trust in love. And here it says 'love is brightest in the dark' and... (she turns to face him, but doesn't yet meet his eyes) has a picture of them kissing. (shyly) Well... what if we kissed? See? It was a crazy idea. (tries to laugh it off) Us kissing. What was I thinking? Can you imagine that? (offended) Oh, well I didn't realize it was such a horrible option. (Leaning over at him in anger) Sorry I suggested it! (turning to Aang, infuriated) Well, I'm not sure which I would rather do! I think so. What can we do? That's how the two lovers found each other. They just put out their lights and followed the crystals.  That must be the way out! (excitedly) Let's go! Sokka! Why is your forehead all red?"," You guys are gonna be done soon, right?  We've got a lot of ground to cover if we wanna make it to Omashu today. I can be ready in two minutes. Seriously. (He lifts his hair to look at them and lets his arm drop lazily back into the water.) Whenever. (with an accusing finger pointed at Chong) Who're you? (firmly) Look, I hate to be the wet blanket here, but since Katara is busy I guess it's up to me. (Katara, whose hair is being braided by Lily, looks crossly up at Sokka at this) We need to get to Omashu. (Counting off the verboten distractions on his hand) No sidetracks, no worms, and definitely no rainbows. (emphatically) O. Ma. Shu. I think we'll just stick with flying. We've dealt with the Fire Nation before. We'll be fine. (terrified) AAAAAHHHHH! (unenthusiastically) Secret love cave. Let's go. How far are we from the tunnel. Labyrinth ! (in exasperation) Curse! What exactly is this curse? (aggravated) That's it! There's no way we're going througbrh some cursed hole! That's Fire Nation. They're tracking us. Everyone into the hole! We will be fine. All we need is a plan. Chong, how long do those torches last? (while grabbing and stomping out the torches she lit) It doesn't work like that if they're all lit at the same time! I'm gonna make a map to keep track of exactly where we've been. Then we should be able to solve it like a maze and get through. This doesn't make any sense; we already came through this way. There's something strange here. There's only one explanation. The tunnels are changing. (cynically) Right. If only we listened to you. Noooooooo!  (defensively) At least I'm thinking of ideas and trying to get us out of here, Moku. (explodes) Yes! We're all thinking of ideas! No, they were trying to get away from something. (trying to sing to the one note he's strumming and not doing very well) Badger moles, coming toward me. Come on guys, help me out. How did you guys get out? Really? We let huge ferocious beasts lead our way. (sullenly, but also blushing) Just play your songs. The journey was long and annoying, but now you get to see what it's really about - the destination.  I present to you the Earth Kingdom city of O... (devastated with realization) Oh, no..."," (frustrated) I didn't find anything to eat. I can't live like this. I wasn't meant to be a fugitive. (kicks at the ground angrily) This is impossible! (more calmly) Uncle... what are you doing? We need food, not tea. I'm going fishing. (horrified) You didn't! (in repulsion) Yah! (losing his patience) We're not taking any more chances with these plants! We need to get help. (musingly) If the Earth Kingdom, discovers us, they'll have us killed. Earth Kingdom it is. (standing and talking quickly) Yes, we're travelers. (hesitantly) Names Of course we have names. I'm... Lee. And this is my uncle, uh... Mushi.  Sorry, but we need to be moving on. I haven't seen my father in many years. Yeah. (quietly, without much feeling) Thank you. (quietly, but intensely) I know. They're about to show us a little more kindness. (offers his hand to Iroh) Well?",,
