episode_num,episode_title,link,Aang,Katara,Sokka,Zuko,Azula,Toph
38,The Earth King,http://atla.avatarspirit.net/transcripts.php?num=218," (ardently) I missed you more than you'll ever know, buddy. (leaping into the scene) But now that we have Appa back, there is nothing stopping us from telling the Earth King the truth about the conspiracy and the war. (urgently) We need to talk to you! (attempting charm) See, we're friends, your Earthiness. Over here. (effortlessly escaping his bonds, Aang raises up his arms, then allows them to be bound behind him again)  (approaching the throne) Well, sir, there is a war going on right now. For the past 100 years, in fact. The Dai  Li's kept it secret from you. It's a conspiracy to control the city, and to control you. (accusingly) Long Feng didn't want us to tell you, so he stole our Sky Bison to blackmail us. And blackmail is the least of his crimes, he brain washed our friend! Right there! Appa bit him. Oh yeah. (Aaag vaults upward, to land in front of the departing King) If you come with us to the outer wall, we can prove to you that the secret war is real! (under his breath) I wish it wasn't. It's still there! (earnestly) We don't have much time. There's a comet coming this summer. Its energy will give the fire benders unbelievable strength. They'll be unstoppable. (Momo hops to sit atop Bosco, as the Earth King leans forward intently)  Secret files? (reading) It's from the Eastern Air Temple. (reading his scroll) I can't believe it. There's a man living at the Eastern Air Temple. He says he's a Guru. (Momo seems to study the scroll beside him)  (eagerly) No, a spiritual expert. He wants to help me take the next step in the Avatar journey. He says he can teach me to control the Avatar State. (distraught) Split up? We just found Appa and got the family back together. Now you want us to separate?  (smiling) Well, if I'm going to the Eastern Air Temple. Appa and I can drop you at Chameleon Bay to see your Dad. (softly) Katara, I need to tell you something. I've been wanting to say it for a long time. (blushes and looks down)  (hesitantly, still blushing) Katara, I... Yeah. (love-struck) Yeah, girls are waiting for us. Thanks ""positive attitude""."," (critically) One good hour after weeks of trouble isn't much of a roll. (unconvinced) Sokka, Long Feng is control of the city. His conspiracy with the Dai Li is too powerful. I think we should just keep flying and leave this horrible place behind us. (thoughtfully) Well, I guess if the Earth King knew the truth, things could change. (both boys smile again)  (pauses, then decisively) Let's fly! We have to be careful. Long Feng's probably warned the King that we're coming. Sorry! (winces at the soldiers cries of pain)  Sorry! We just need to get through to see the Earth King.  (appealing) You have to trust us. (astonished) So you've never been outside the upper ring before? The Dai Li must have known we were coming and destroyed the evidence. (suddenly inspired) The wall! They'll never be able to cover that up in time! (sarcastically) Really Then perhaps you can explain why there's a Fire Nation insignia on your construction project. (gestures toward the drill, which bears the symbol clearly upon its back)  (unrolling and reading) It's a letter from your mom. You mom's here in the city, and she wants to see you. (Toph's face lights up in surprise)  (hopefully) Is there a letter for me and Sokka by any chance? (reading) A small fleet of water tribe ships... (in rising excitement) Protecting the mouth of Chameleon Bay, led by Hakoda. It is Dad! (happily) And I can't believe we know where our Dad is now. (holds the report)  I hate to say it, but...we have to split up. (firmly) You have to meet this Guru, Aang. If we're gonna invade the Fire Nation, you need to be ready. (rises) No Sokka, I know how badly you want to help Dad. You go to Chameleon Bay, I'll stay here with the king. (pushes him back) Easy there, big brother. (pleased) Though you're right, I am. (curiously) What is it Aang? (turning to the departing Avatar) Wait, Aang.  Me too."," (confidently) Look, we escaped from the Dai Li, we got Appa back, I'm telling you, we should go to the Earth King now and tell him our plan. We're on a roll. We can build on it. If we want to invade the Fire Nation when the eclipse happens, we need the Earth King's support.  I know, but I've got a good feeling about this. This time will be different. See, Aang's with me. (puts arm over smiling Aang's shoulder, flashing a wide grin) It's the whole reason we came here in the first place, we have to try.  That's probably the Dai Li searching for us. (turns to Katara) So? There it is. That whole thing is the palace. The Earth King's chambers should be in the center. (another shot of the palace, and the vast open plaza in front)  Why would you assume that? If you ask me, I think we're just gonna sail right in....Ahhh!  (shouting in alarm) Surface to air rocks! (below, several rows of massive, puck-shaped boulders are being launched skyward by teams of earthbending troops) More incoming! Ahhh! Seriously, we're actually on your guys' side. (soldiers continue to slide past) Sorry. In there. Toph, which way to the Earth King? (closing door behind him) Sorry, wrong door. Now that's an impressive door. It's gotta go somewhere. A little warning next time! (rubs the back of his head as he rises) No, we're on your side. We're here to help. (confused) But we dropped our weapons. We're your allies. Uh, no, him. (nods his head toward Aang)  Wait, I can prove he's lying. Long Feng said he's never seen a Sky Bison, ask him to lift his robe. (smugly) Never met a Sky Bison , huh? Of course there is! Underneath Lake Laogai, Your Kingliness. To the Dai Li's secret headquarters. You're about to see where all the brainwashing and conspiring took place. (raises hands to his face in dismay) Oh, don't tell me.. (slumps, then recovers and flashes a thumbs-up) That's ok, still got my positive attitude. Hey, if anything, this proves the conspiracy exists even more. (rushing up) If you come with us, this time you can ride on Appa.  It's a drill. A giant drill made by the Fire Nation, to break through your walls. (shouting after him mockingly) Looks like Long Feng is ""long gone""! Ha...Oh, yeah, I've been waitin' to use that one. (rubs a tear from one of his eyes)  (stepping forward) That's why we came to Ba Sing Se, Your Highness. Because we think you can help us end the war. (Momo perches on the King's shoulder)  But there is hope. Before the comet comes, we have a window of opportunity. A solar eclipse is coming. The sun will be entirely blocked out by the moon, and the fire benders will be helpless.  (decisively) That's the day we need to invade the Fire Nation. The Day of Black Sun. You're already vulnerable. The Fire Nation won't stop until Ba Sing Se falls. You can either sit back and wait for that to happen, or take the offensive, and give yourself a fighting chance.  (everyone waits anxiously as the King considers his options)  (both siblings exchange sorrowful looks) Oh. (eagerly) What? That could be Dad. What's a Guru? Some kind of poisonous blowfish? (scratches the back of his head)  This is all such big news. Where do we even start? (resigned) Someone has to stay here with the Earth King and help him plan for the invasion. I guess that's me? (rises to his feet with a glum expression) (tears welling in his eyes) You are...the nicest... sister...ever. (does a strange little happy dance, throws his arms around her and kisses her cheek)  (abruptly interrupts, throwing Aang in a headlock) Alright! Who's ready to get going on our little men-only man trip (gives Aang a head-noogie, as Katara wears a incredulous expression)  (shocked) That's Suki!! (freezing while climbing Appa's side, he slips and falls to the stone plaza, sits up, and begins rubbing his sore back)  ( rising, speaking confidently) Oh yeah. The Kyoshi warriors are a skilled group of fighters, trust worthy too. They're good friends of ours. (embarrassed)Ahhh! Great! That's enough! Ok, we love each other. (pats Katara and Aang's head)  Seriously. (cheerfully) Everything's gonna work out perfectly, from now on and forever. (Aang turns and shares his smile) "," (feebly) I don't feel right. (feebly) So thirsty. (tries to sit up, but is pushed back down by Iroh)  I'm not tired. (disorientated) What? What's happening? What's that mean (collapses in a fit of coughing)  Ahhhh! (sitting up in a jolt, he breathes heavily, eyes wide) "," (her voice is steady, her eyes cool and deadly)  We are the Earth King's humble servants."," What makes you think we'll get it? I don't know if you've noticed, but things don't usually go that smoothly for our little gang.  I'm with sweetness. I've seen enough of Ba Sing Se, (raises arms and opens eyes wide) and I can't even see! (rising to feet) I don't trust the new positive Sokka. (points accusingly) Long Feng brainwashed you, didn't he! (pleading) Can we please buy a new saddle? Riding bareback is terrifying! (buries face in Appa's back)  (shouting over the wind) What was that?! How should I know? I'm still voting that we leave Ba Sing Se. (sardonically) He has a good point. It's gone! (irreverently) First time flying? Yeah, I hate it too. (disgusted) Long Feng intercepted our letters from home? That's just sad. (reassured) I know what you mean. My Mom's in the city, and from her letter it sounds like she finally understands me. (quietly) I'm really gonna miss you guys. Hello? Mom? Anyone home?  (frightened) Hey! Who do you think you're dealing with?! (outside, two figures drop down from above) "
39,The Guru,http://atla.avatarspirit.net/transcripts.php?num=219," (enthusiastically) You haven't seen your Dad in over two years. You must be so excited. (reassuringly) Don't be nervous, he's going to be so happy to see you. (places arm on Sokka's shoulder, causing him to smile slightly) (confidently) Not at all. I'm ready to master the Avatar State. I'll do whatever it takes. (Sokka drops off of Appa's back, looks up at Aang) See you in a week. Yip Yip! (uncertainly) Um, hello? (hops down, starts up stairs) You're Guru Pathik, right? The person who attached the note to Appa's horn? (sits facing the Guru) In your note, you said you could teach me to gain control of the Avatar State. How? (appalled) Ugh! It tastes like onion and banana juice! (rubbing an eye) What are chakras? So chakras are pools of spiraling energy in our bodies? The creek can't flow? (eagerly) The energy flows!  (pauses momentarily) I'll do whatever it takes. (recoiling in terror) Ahhhhh!  Water chakra?(voice-over) I ran away.  (sadly) I hurt all of those people. (holding his stomach) My Fire chakra would like to eat something other than onion-banana juice. (softly) I'm never going to fire bend again. I can't. (belching loudly) Urrp! Tastes like onion and bananas, but strangely something else. Pickles? (voice thick with emotion) Can I have some onion banana juice please? Because I never wanted to be. Like the four nations.  We're all connected. (opens his eyes) Everything is connected. This is the last chakra isn't it? (confident) Let's do this. (startled) What? Why would I let go of Katara? I...I..I love her. (crossly) Why would I choose cosmic energy over Katara? How could it be a bad thing that I feel an attachment to her? Three chakras ago, that was a good thing. I'm sorry, but I can't let go of Katara. (reluctantly) Okay, I'll try. (rising in alarm) Katara is in danger! I have to go. "," (amused) Or we could send in Momo to do some damage. (laughing) Cause the... (continues to laugh, then notices the grim expressions of the Council)...sorry.  (respectfully) I'll get these scrolls to him right away. Thank you, General How.  Why didn't you tell us you were the Avatar? (The scene shifts back to the sitting Aang)  What do you say Momo? A cup of tea before we get back to the king? (steps inside the entrance) Table for two please. Thank goodness you are here, Suki. Something terrible is going on. The Fire Nation has infiltrated the city. I just saw Prince Zuko and his Uncle! (Azula's eyes snap open at this news, and she smiles) We have to tell the Earth King right away!"," (visibly nauseous) I know I should be, but I just feel sick to my stomach.  So what about you? Are you nervous to meet this Guru?  (voice thick with emotion) Hi Dad. Destructive, buoyant, and (takes a smell of the cap, recoils in disgust) terrible smelling. (laughing hysterically) Ha ha! Good one Dad! (uncertain) Uh, what should I do, Dad? (earnestly) You don't know how much this means to me dad. I'll make you proud, and I'll finally prove to you what a great warrior I am. Really? (apprehensively) This can't be good news."," What's that smell?  (Iroh is seen stirring a thick white paste in a steaming pot.)  (pleasantly) Actually, it smells delicious. I'd love a bowl, Uncle. (The banished Prince picks up and holds out a bowl.)  (optimistically) It's a new day. We've got a new apartment, new furniture, and today's the grand opening of your new tea shop. Things are looking up Uncle.  (cheerfully) Congratulations Uncle. (confidently) You deserve it. The Jasmine Dragon will be the best tea shop in the city. (enthusiastically) Now let's make these people some tea. Uncle, I need two jasmine, one green and one lychee!  (walking over) What is it Uncle?"," (smoothly) It's terrible when you can't trust the people who are closest to you. (feigning enthusiasm) Really? Now that sounds like a fascinating and brilliant plan.  We have been presented with an extraordinary opportunity, girls. (walking to a window) I'm talking about conquering the whole Earth Kingdom. (the two girls turn with shocked looks) (staring out the window) For a hundred years the fire nation has hammered away at Ba Sing Se from the outside. But now we are on the inside, and we can take it by ourselves. From the inside we're in the perfect position to organize a coup and overthrow the Earth King. The key is the Dai Li. Whoever controls the Dai Li, controls Ba Sing Se.  Good work girls. (glances up toward the roof) I am sure the Dai Li will deliver the message.  (rising to her feet) Oh, don't worry. I'll be sure to let him know.  So, Zuzu's in the city too. I think it's time for a family reunion.  (outraged) What is this about? Your agents show up in the middle of the night and drag me down here? You will not treat a Kyoshi Warrior this way! (struggles against her captors)  (stops struggling) What do you want? Oh?  (warily) Why should I help you? I'm listening. (both smile wickedly) "," (urgently shouting) Hey! Can you two old ladies quit your bickering for a second? I gotta go to the bathroom! (she is seen standing inside the dark box)  (furious) Let me out of here, so I can kick both your butts! (bangs on walls)  (straining) Come on metal.... budge.  Whoo! Toph, you rule! (does a double fisted strike at the wall)  It's not! It's the real deal! (triumphantly) I am the greatest earthbender in the world! Don't you two dunderheads ever forget it!"
40,The Crossroads of Destiny,http://atla.avatarspirit.net/transcripts.php?num=220," (worried) I don't know. In my vision, I just knew she needed help. Oooo! (smiling sheepishly) I'm great. It went great with the Guru. I completely mastered the Avatar State. Heh heh...heh. Yeah. But, in my vision. I felt so sure that she was in trouble.  Ok, maybe you're right. Momo! Katara is in trouble! I knew it! Huh uh ! (shocked) You guys know each other! She must have Katara. Then we'll work together to fight Azula, and save Katara and Zuko.  Katara is in trouble. All of Ba Sing Se is in trouble. Working together is our best chance. So, Toph thinks you give pretty good advice. And great tea.  Well, I met with this Guru who was supposed to help me master the Avatar State, and control this great power. But to do it, I had to let go of someone I love, and I just couldn't.  What happens if we can't save everyone and beat Azula? Without the Avatar State, what if I am not powerful enough? Saving you, that's what. There's too many. (sadly)I 'm sorry Katara."," (surprised) Zuko! (accusingly) Why did they throw you in here? Oh wait. Let me guess. It's a trap. So when Aang shows up to rescue me, you can finally have him in your little Fire Nation clutches.  You're a terrible person, you know that? Always following us, hunting the Avatar, trying to capture the world's last hope for peace! But what do you care? You're the Fire Lord's son. Spreading war and violence and hatred is in your blood.  (growing angrier) I don't?! How dare you! You have no idea what this war has put me through. Me personally (turns her back to Zuko and crouches down). The Fire Nation took my mother away from me. I'm sorry I yelled at you before. It's just that for so long now, whenever I would imagine the face of the enemy, it was your face.(regretfully) No, no, that's not what I meant. Maybe you could be free of it.  I have healing abilities. This is water from the Spirit Oasis at the North Pole. It has special properties, so I have be saving it forsomething important. (walks up to Zukoand faces him) I don't know if it would work, but...Aang! Aang, I knew you would come. We've got to find Sokka and Toph. I thought you had changed!"," So, what kind of trouble is Katara in? It would be nice if your Avatar powers could be just a little more specific from time to time.  What is that?!  Need a ride?  Oooo! Aang, are you ok? See Aang? She's with Suki. They're probably back at our apartment right now, talking about make up or something. Oh no. Huh uh ! Woah there. You lost me at, ""Zuko"". Good inside of him isn't enough. Why don't you come back when it's outside him too, okay?  (angrily) My sister! Where are they keeping Katara? (points his machete at the Dai Li agent)  We should split up. Aang, you go with Iroh to look for Katara and the angry jerk...no offense. And I'll go with Toph to warn the Earth King about Azula's coup. There's General How! The coup is happening right now! We've got to warn the Earth King! Thank goodness we're in time! (sweating)  Uh, I'm kinda involved with Suki. Nope. All clear.  Let's go!"," (cheerfully) It sure is Uncle. What's taking so long?  Something's not right.  (standing to his feet) Azula! No. I'm tired of running. It's time I faced Azula! (angry and determined) Yes! I challenge you! You don't know what you're talking about. I'm sorry. That's something we have in common. It doesn't matter. My face. I see (turns away and places a hand to his scar). It's ok. I used to think this scar marked me. The mark of the banished prince, cursed to chase the Avatar forever. But lately, I've realized I'm free to determine my own destiny, even if I'll never be free of my mark.  What? It's a scar. It can't be healed. (upset) Uncle, I don't understand. What are you doing with the Avatar!! (points a finger at Aang)  (hurt) Why Uncle?  Release him immediately! I have changed. (regretfully)  I betrayed Uncle. But I don't have the Avatar. What if Father doesn't restore my honor?"," The Earth King and The Council of Five do not trust the Dai Li. They imprisoned your leader, Long Feng. Soon they will turn on all of you, and eliminate you. Seizing power today is a matter of life and death. (Cut to a close up of a Dai Li lowering his head in anxiety. Azula steps down from the pedestal and comes closer to the agents.) The coup must be swift and decisive. The Earth King, and each of the five generals, must be taken out simultaneously. Long Feng has placed you in me command while we overthrow the government. (Azula walks toward a Dai Li agent with a scar on his cheek and look him in the eyes.) If I sense any disloyalty, any hesitation, any weakness at all, I will snuff it out. That is all.  There are still a few loose ends. The Avatar, and my brother and Uncle. (mockingly) It's tea time. Have you met the Dai Li? They're Earthbenders, but they have a killer instinct that is so Firebender, I just love it! (examining her nails and speaking in a bored tone) I'm not interested in a lengthy anecdote, Uncle. You're so dramatic. What, are you going to do, challenge me to an Agni Kai? (smiling mockingly)  No thanks.This fight... is over. Get them all out of my sight. It's because they haven't made up their minds. They're waiting to see how this is going to end. I can see your whole history in your eyes. You were born with nothing. So you had to struggle and connive and claw your way to power. But true power...the divine right to rule...is something you're born with. The fact is, they don't know which one of us is going to be sitting on that throne and which one is going to be bowing down. But I know. And you know. (Long Feng begins to sweat. His face is full of hesitation and uncertainty. Azula sits on the Earth King's throne and crosses her legs.)  Well?Don't flatter yourself. You were never even a player. I expected this kind of treachery from Uncle, but Zuko, Prince Zuko...you're a lot of things, but you're not a traitor, are you?It's not too late for you Zuko. You can still redeem yourself. Why don't you let him decide, Uncle? I need you Zuko. I've plotted every move of this day. This glorious day in Fire Nation history. And the only way we win is together. At the end of this day, you will have your honor back. You will have your father's love. You will have everything you want.  You are free to choose. We've done it Zuko. It's taken a hundred years, but the Fire Nation has conquered Ba Sing Se. No, he betrayed you. Zuko, when you return home, father will welcome you as a war hero. He doesn't need to Zuko. Today, you restored your own honor."," Ahhh! So how did it go with the Guru? Did you master the Avatar State? There's no one else here. Wait, someone's at the door. (points back at the door. A moment later, someone knocks on it.) Actually, I know who it is. It's an old friend of mine. (Toph walks to the door and slides it open to reveal Iroh.)  Glad to see you're okay. I met him in the woods once and knocked him down. Then he gave me tea and very good advice. Well whaddya know. There is an ancient city down there, but it's deep. They're not the real Kyoshi Warriors! See any Dai Li agents near by? That is a nice trick."
